{
  "ownerAccount": "example-ownerAccount",
  "virtualInterfaceId": "dxcon-abc123456",
  "location": "example-location",
  "connectionId": "dxcon-abc123456",
  "virtualInterfaceType": "example-virtualInterfac",
  "virtualInterfaceName": "Example virtualInterfaceName",
  "vlan": "123",
  "asn": "example-asn",
  "amazonSideAsn": "dxcon-abc123456",
  "authKey": "example-authKey",
  "amazonAddress": "example-amazonAddress",
  "customerAddress": "example-customerAddress",
  "addressFamily": "example-addressFamily",
  "virtualInterfaceState": "available",
  "customerRouterConfig": "example-customerRouterC",
  "mtu": "example-mtu",
  "jumboFrameCapable": "example-jumboFrameCapab",
  "virtualGatewayId": "dxcon-abc123456",
  "directConnectGatewayId": "dxcon-abc123456",
  "routeFilterPrefixes": "example-routeFilterPref",
  "bgpPeers": "example-bgpPeers",
  "region": "example-region",
  "awsDeviceV2": "example-awsDeviceV2",
  "awsLogicalDeviceId": "dxcon-abc123456",
  "tags": "example-tags",
  "siteLinkEnabled": "example-siteLinkEnabled"
}